
<!ELEMENT site ( page* )>

<!ELEMENT page ( name, page* )>
<!ATTLIST page
	file CDATA #REQUIRED
	templated ( true | false ) "true"
  	>

<!ELEMENT name ( #PCDATA )>